{
  "decision_version": "1.0",
  "decision_id": "dec_demo-normal-001",
  "timestamp": "2026-03-06T19:51:30.347Z",
  "rules_triggered": [
    "G-MISSING-SKU"
  ],
  "action": "require_review",
  "mode": "active",
  "risk_level": "medium",
  "confidence_adjustment": 0,
  "notes": "Applied rules: G-MISSING-SKU"
}