{
  "decision_version": "1.0",
  "decision_id": "dec_demo_001",
  "timestamp": "2026-03-21T15:00:00Z",

  "rules_triggered": [
    "G-LOSS-PENALTY",
    "R-MODEL-MISSING"
  ],

  "action": "require_review",
  "mode": "active",
  "risk_level": "high",

  "confidence_adjustment": -0.2,

  "notes": "Decision generated by Policy Engine based on semantic compression loss and missing product model."
}